{
  "api_family": "v1",
  "default_api_version": "2026-08-04",
  "excluded_operations": [
    {
      "method": "POST",
      "operation_id": "build_graph_v1_graph_build_post",
      "owner": "Runtime Platform",
      "path": "/v1/graph/build",
      "reason": "Graph setup is managed through the dashboard and control-plane workflow, not the retrieval SDK.",
      "review_date": "2027-02-04"
    },
    {
      "method": "POST",
      "operation_id": "create_text_configuration_v1_text_configurations_post",
      "owner": "Runtime Platform",
      "path": "/v1/text/configurations",
      "reason": "Text setup is managed through the dashboard and control-plane workflow, not the retrieval SDK.",
      "review_date": "2027-02-04"
    },
    {
      "method": "POST",
      "operation_id": "create_vector_configuration_v1_vector_configurations_post",
      "owner": "Runtime Platform",
      "path": "/v1/vector/configurations",
      "reason": "New pgvector configuration creation is retired; use project.context.create_collection with a native pgcontext.vector column.",
      "review_date": "2027-02-04"
    },
    {
      "method": "DELETE",
      "operation_id": "delete_text_configuration_v1_text_configurations__config_id__delete",
      "owner": "Runtime Platform",
      "path": "/v1/text/configurations/{config_id}",
      "reason": "Text setup is managed through the dashboard and control-plane workflow, not the retrieval SDK.",
      "review_date": "2027-02-04"
    },
    {
      "method": "DELETE",
      "operation_id": "delete_vector_configuration_v1_vector_configurations__config_id__delete",
      "owner": "Runtime Platform",
      "path": "/v1/vector/configurations/{config_id}",
      "reason": "Vector setup is managed through the dashboard and control-plane workflow, not the retrieval SDK.",
      "review_date": "2027-02-04"
    },
    {
      "method": "POST",
      "operation_id": "discover_graph_v1_graph_discover_post",
      "owner": "Runtime Platform",
      "path": "/v1/graph/discover",
      "reason": "Graph discovery is a setup operation managed outside the retrieval SDK.",
      "review_date": "2027-02-04"
    },
    {
      "method": "POST",
      "operation_id": "discover_vectors_v1_vector_discover_post",
      "owner": "Runtime Platform",
      "path": "/v1/vector/discover",
      "reason": "Vector discovery is a setup operation managed outside the retrieval SDK.",
      "review_date": "2027-02-04"
    },
    {
      "method": "GET",
      "operation_id": "get_graph_configuration_v1_graph_configuration_get",
      "owner": "Runtime Platform",
      "path": "/v1/graph/configuration",
      "reason": "Graph configuration is managed through the dashboard and control-plane workflow.",
      "review_date": "2027-02-04"
    },
    {
      "method": "GET",
      "operation_id": "get_graph_system_v1_graph_system_get",
      "owner": "Runtime Platform",
      "path": "/v1/graph/system",
      "reason": "Graph system configuration is an administrative Runtime concern.",
      "review_date": "2027-02-04"
    },
    {
      "method": "GET",
      "operation_id": "get_text_configuration_v1_text_configurations__config_id__get",
      "owner": "Runtime Platform",
      "path": "/v1/text/configurations/{config_id}",
      "reason": "Text configuration is managed through the dashboard and control-plane workflow.",
      "review_date": "2027-02-04"
    },
    {
      "method": "GET",
      "operation_id": "get_vector_configuration_v1_vector_configurations__config_id__get",
      "owner": "Runtime Platform",
      "path": "/v1/vector/configurations/{config_id}",
      "reason": "Vector configuration is managed through the dashboard and control-plane workflow.",
      "review_date": "2027-02-04"
    },
    {
      "method": "POST",
      "operation_id": "graph_maintenance_v1_graph_maintenance_post",
      "owner": "Runtime Platform",
      "path": "/v1/graph/maintenance",
      "reason": "Graph maintenance is an administrative Runtime operation.",
      "review_date": "2027-02-04"
    },
    {
      "method": "GET",
      "operation_id": "graph_status_v1_graph_status_get",
      "owner": "Runtime Platform",
      "path": "/v1/graph/status",
      "reason": "Graph build status is part of setup management; retrieval readiness is the SDK-facing status.",
      "review_date": "2027-02-04"
    },
    {
      "method": "GET",
      "operation_id": "healthz_v1_healthz_get",
      "owner": "Runtime Operations",
      "path": "/v1/healthz",
      "reason": "Health checks are operational endpoints and are not application retrieval methods.",
      "review_date": "2027-02-04"
    },
    {
      "method": "GET",
      "operation_id": "list_text_configurations_v1_text_configurations_get",
      "owner": "Runtime Platform",
      "path": "/v1/text/configurations",
      "reason": "Text configuration is managed through the dashboard and control-plane workflow.",
      "review_date": "2027-02-04"
    },
    {
      "method": "GET",
      "operation_id": "list_vector_configurations_v1_vector_configurations_get",
      "owner": "Runtime Platform",
      "path": "/v1/vector/configurations",
      "reason": "Vector configuration is managed through the dashboard and control-plane workflow.",
      "review_date": "2027-02-04"
    },
    {
      "method": "GET",
      "operation_id": "metrics_v1_metrics_get",
      "owner": "Runtime Operations",
      "path": "/v1/metrics",
      "reason": "Metrics are operational endpoints and are not application retrieval methods.",
      "review_date": "2027-02-04"
    },
    {
      "method": "PATCH",
      "operation_id": "patch_graph_system_v1_graph_system_patch",
      "owner": "Runtime Platform",
      "path": "/v1/graph/system",
      "reason": "Graph system configuration is an administrative Runtime concern.",
      "review_date": "2027-02-04"
    },
    {
      "method": "PATCH",
      "operation_id": "patch_text_configuration_v1_text_configurations__config_id__patch",
      "owner": "Runtime Platform",
      "path": "/v1/text/configurations/{config_id}",
      "reason": "Text setup is managed through the dashboard and control-plane workflow, not the retrieval SDK.",
      "review_date": "2027-02-04"
    },
    {
      "method": "PATCH",
      "operation_id": "patch_vector_configuration_v1_vector_configurations__config_id__patch",
      "owner": "Runtime Platform",
      "path": "/v1/vector/configurations/{config_id}",
      "reason": "Vector setup is managed through the dashboard and control-plane workflow, not the retrieval SDK.",
      "review_date": "2027-02-04"
    },
    {
      "method": "PUT",
      "operation_id": "put_graph_configuration_v1_graph_configuration_put",
      "owner": "Runtime Platform",
      "path": "/v1/graph/configuration",
      "reason": "Graph setup is managed through the dashboard and control-plane workflow, not the retrieval SDK.",
      "review_date": "2027-02-04"
    },
    {
      "method": "GET",
      "operation_id": "readyz_v1_readyz_get",
      "owner": "Runtime Operations",
      "path": "/v1/readyz",
      "reason": "Readiness checks are operational endpoints; the SDK uses retrieval readiness instead.",
      "review_date": "2027-02-04"
    },
    {
      "method": "POST",
      "operation_id": "reindex_text_configuration_v1_text_configurations__config_id__reindex_post",
      "owner": "Runtime Platform",
      "path": "/v1/text/configurations/{config_id}/reindex",
      "reason": "Text reindexing is a setup operation managed outside the retrieval SDK.",
      "review_date": "2027-02-04"
    },
    {
      "method": "POST",
      "operation_id": "reindex_vector_configuration_v1_vector_configurations__config_id__reindex_post",
      "owner": "Runtime Platform",
      "path": "/v1/vector/configurations/{config_id}/reindex",
      "reason": "Vector reindexing is a setup operation managed outside the retrieval SDK.",
      "review_date": "2027-02-04"
    },
    {
      "method": "GET",
      "operation_id": "runtime_vector_compatibility",
      "owner": "Runtime Platform",
      "path": "/v1/vector/compatibility",
      "reason": "Vector compatibility bindings are an operator migration surface, not an application retrieval method.",
      "review_date": "2027-02-04"
    },
    {
      "method": "POST",
      "operation_id": "runtime_vector_compatibility_engine",
      "owner": "Runtime Platform",
      "path": "/v1/vector/configurations/{config_id}/compatibility-engine/{target_engine}",
      "reason": "Per-configuration compatibility engine selection is an operator rollback control, not an application retrieval method.",
      "review_date": "2027-02-04"
    },
    {
      "method": "GET",
      "operation_id": "text_configuration_diagnostics_v1_text_configurations__config_id__diagnostics_get",
      "owner": "Runtime Platform",
      "path": "/v1/text/configurations/{config_id}/diagnostics",
      "reason": "Text index diagnostics are managed through the dashboard and control-plane workflow.",
      "review_date": "2027-02-04"
    }
  ],
  "methods": [
    {
      "binding_kind": "operation",
      "deprecated": null,
      "description": "Return passwordless direct and pooled connection information.",
      "example": "connection = project.connection_info()",
      "exception_categories": [
        "api",
        "authentication",
        "maintenance",
        "not_found",
        "permission",
        "rate_limit",
        "runtime",
        "validation"
      ],
      "operation_ids": [
        "runtime_connection_info_get"
      ],
      "operations": [
        {
          "deprecated": false,
          "method": "GET",
          "operation_id": "runtime_connection_info_get",
          "path": "/v1/connection-info",
          "request_contract": [],
          "request_schema": null,
          "security": [
            {
              "RuntimeBearerAuth": []
            }
          ],
          "success_contracts": {
            "200": [
              {